,index,Pattern,Size,Median_Score,P_Value,Q_Value_FDR,Genes,Target_Mean,Background_Mean,Fold_Change,Specificity_P_Val
0,33,PATTERN_44,3,1.0990802391265239e-05,0.000999000999000999,0.000999000999000999,"KCMF1, UBE2A, UBR4",0.3486,0.2667,1.307,0.007813627471576448
1,34,PATTERN_44,3,9.357417951009993e-06,0.000999000999000999,0.000999000999000999,"CARD9, TRIM62, UBE2D2",0.3805,0.2383,1.597,4.0254223473285635e-06
2,31,PATTERN_42,17,1.7805327668517448e-05,0.002997002997002997,0.002997002997002997,"AP1B1, AP1G1, AP1M1, AP1M2, AP1S1, AP1S2, AP1S3, AP2A1, AP2A2, AP2B1, AP2M1, AP2S1, CLTA, CLTC, DNM1, DNM2, VAMP2",0.314,0.228,1.377,0.002644999815590303
3,32,PATTERN_42,3,2.5256178403678186e-05,0.002997002997002997,0.002997002997002997,"RNF19B, STAT1, UBE2L6",0.6945,0.4456,1.558,5.8666471567984454e-05
4,66,PATTERN_69,10,2.3182076828559488e-05,0.000999000999000999,0.003996003996003996,"DDX3X, EIF4A1, EIF4A2, EIF4A3, EIF4E, EIF4E2, EIF4E3, EIF4G1, EIF4G2, EIF4G3",0.4975,0.4005,1.242,0.034012903972797326
5,68,PATTERN_70,4,3.0619850338839076e-05,0.003996003996003996,0.003996003996003996,"BTN3A1, BTN3A2, BTN3A3, XDH",0.1956,0.1319,1.482,0.0018529205495144828
6,30,PATTERN_41,4,1.8195891486897993e-05,0.003996003996003996,0.003996003996003996,"DCTN1, KIF20A, RAB18, RAB6A",0.2273,0.1597,1.424,0.00286429417486911
7,47,PATTERN_56,3,3.6344127774110116e-05,0.007992007992007992,0.007992007992007992,"ADAM8, ASB17, ASB2",0.0451,0.0301,1.498,0.0045347621890866295
8,46,PATTERN_56,4,3.580595445846601e-05,0.005994005994005994,0.007992007992007992,"BTN3A1, BTN3A2, BTN3A3, XDH",0.1956,0.1319,1.482,0.0018529205495144828
9,61,PATTERN_66,5,1.5775141290436427e-05,0.007992007992007992,0.007992007992007992,"ALOX15, ALOX5, COTL1, PLA2G2A, PLA2G6",0.2112,0.128,1.65,0.00032900883338992634
10,29,PATTERN_39,17,1.5110997475096757e-05,0.001998001998001998,0.007992007992007992,"AMPD3, APRT, ARSA, ASAH1, CANT1, CTSA, GAA, GALNS, GLA, GLB1, HEXB, IMPDH1, IMPDH2, MGAM, NEU1, PNP, PSAP",0.1921,0.1371,1.401,0.0002561073868125683
11,50,PATTERN_58,5,1.8457752656059354e-05,0.004995004995004995,0.00999000999000999,"CDC20, CUL1, DSN1, FBXL19, SKP1",0.3605,0.2626,1.373,0.00131247990951204
12,72,PATTERN_9,5,3.7001773938822216e-05,0.000999000999000999,0.010989010989010988,"DDX58, IFNAR1, IL6, ISG15, STAT1",0.5488,0.3442,1.595,1.9027277301202643e-05
13,64,PATTERN_68,4,6.08861859316588e-06,0.002997002997002997,0.011988011988011988,"FTH1, FTL, HMOX1, PLA2G6",1.4003,1.0509,1.333,9.361372803244649e-05
14,23,PATTERN_31,5,1.675609236649377e-05,0.002997002997002997,0.011988011988011988,"GDI2, RAB24, RAB5B, RAB5C, RBSN",0.2386,0.17,1.403,0.002014724469788373
15,27,PATTERN_38,6,1.0317824156000528e-05,0.011988011988011988,0.011988011988011988,"ADAM10, IL6, NCSTN, PSEN1, TLR6, TNF",0.1602,0.1254,1.277,0.019264957710427737
16,12,PATTERN_24,6,2.001846929197076e-05,0.005994005994005994,0.011988011988011988,"GDI2, RAB14, RAB24, RAB5B, RAB5C, RBSN",0.2753,0.1963,1.403,0.0013515889443097174
17,28,PATTERN_38,3,1.5575653093755064e-05,0.008991008991008992,0.011988011988011988,"RAP1A, RAP1B, SIPA1",0.7791,0.5697,1.368,0.0006670546141028602
18,63,PATTERN_68,25,6.1543276770267874e-06,0.003996003996003996,0.011988011988011988,"AP1B1, AP1G1, AP1M1, AP1M2, AP1S1, AP1S2, AP1S3, AP2A1, AP2A2, AP2B1, AP2M1, AP2S1, ARF1, CLTA, CLTC, SNAP23, SNAP25, SNAP29, STX1A, STX3, STX4, VAMP2, VAMP3, VAMP7, VAMP8",0.2969,0.2142,1.386,0.0017024420926541794
19,62,PATTERN_67,3,1.0665665667490254e-05,0.012987012987012988,0.012987012987012988,"KCMF1, UBE2A, UBR4",0.3486,0.2667,1.307,0.007813627471576448
20,13,PATTERN_24,5,6.223677045618017e-05,0.00999000999000999,0.01332001332001332,"EDA, EDA2R, EDAR, EDARADD, TRAF6",0.0453,0.0258,1.756,0.0008863262728199183
21,38,PATTERN_51,11,1.9681592738103094e-05,0.006993006993006993,0.013986013986013986,"ARSA, ASAH1, GALNS, GLA, GLB1, GNS, HEXB, MAN2B1, MANBA, NEU1, PSAP",0.1565,0.1145,1.367,0.002071294873806043
22,65,PATTERN_69,24,1.6254694477162342e-05,0.006993006993006993,0.013986013986013986,"ATP6AP2, ATP6V0A1, ATP6V0A2, ATP6V0A4, ATP6V0B, ATP6V0C, ATP6V0D1, ATP6V0D2, ATP6V0E1, ATP6V0E2, ATP6V1A, ATP6V1B1, ATP6V1B2, ATP6V1C1, ATP6V1C2, ATP6V1D, ATP6V1E1, ATP6V1E2, ATP6V1F, ATP6V1G1, ATP6V1G2, ATP6V1G3, ATP6V1H, TCIRG1",0.2735,0.1999,1.369,0.0002052844876127755
23,52,PATTERN_59,3,1.835234917360779e-05,0.005994005994005994,0.014985014985014984,"BTN2A1, CD209, XDH",0.0572,0.0395,1.447,0.0034373303574209493
24,51,PATTERN_59,4,3.430933412843392e-05,0.005994005994005994,0.014985014985014984,"ARMC8, UBA1, UBE2H, YPEL5",0.2992,0.1984,1.508,0.00019773403327938646
25,6,PATTERN_13,3,2.2749911256414153e-05,0.008991008991008992,0.014985014985014988,"ADGRE5, CD55, CD59",0.3677,0.2934,1.253,0.025102754657663262
26,5,PATTERN_13,5,1.2896370742455417e-05,0.007992007992007992,0.014985014985014988,"RAP1A, RAP1B, RAP1GAP2, YWHAB, YWHAZ",1.0755,0.7586,1.418,6.128293541633518e-05
27,48,PATTERN_57,26,1.4817337632523547e-05,0.007992007992007992,0.015984015984015984,"AGL, ALDOA, ALDOC, AMPD3, APRT, ARSA, ARSB, ASAH1, CANT1, DERA, GALNS, GLA, GLB1, GPI, GUSB, HK3, IMPDH1, IMPDH2, NEU1, PGAM1, PGM1, PGM2, PNP, PYGB, PYGL, TALDO1",0.1905,0.149,1.278,0.010419830578947782
28,59,PATTERN_64,5,2.7425766854727514e-05,0.01098901098901099,0.01748251748251748,"LNPEP, RAB10, RAB14, SNAP23, STX4",0.3917,0.2944,1.33,0.002506940848539779
29,57,PATTERN_64,17,2.0160271224932064e-05,0.013986013986013986,0.01748251748251748,"AP1B1, AP1G1, AP1M1, AP1M2, AP1S1, AP1S2, AP1S3, AP2A1, AP2A2, AP2B1, AP2M1, AP2S1, CLTA, CLTC, DNM1, DNM2, VAMP2",0.314,0.228,1.377,0.002644999815590303
30,19,PATTERN_29,3,1.9665596425273433e-05,0.005994005994005994,0.017982017982017984,"PIK3C3, RAB5C, RBSN",0.2317,0.1524,1.521,0.00015732152054967396
31,11,PATTERN_21,3,2.7692630787147144e-05,0.005994005994005994,0.017982017982017984,"RNASE2, RNASE6, RNASET2",0.244,0.0978,2.496,1.584859707481007e-08
32,41,PATTERN_52,3,4.5058080355330884e-05,0.00999000999000999,0.018648018648018648,"COMMD3, COMMD9, VPS35L",0.228,0.15,1.52,0.0006458924462427055
33,40,PATTERN_52,18,1.658956572182905e-05,0.005994005994005994,0.018648018648018648,"CUL3, GAN, GLMN, KBTBD6, KBTBD7, KBTBD8, KEAP1, KLHL13, KLHL2, KLHL20, KLHL21, KLHL22, KLHL25, KLHL3, KLHL41, KLHL42, KLHL9, RBX1",0.1748,0.1188,1.471,0.00026556786729346055
34,42,PATTERN_52,3,7.221781718193939e-06,0.013986013986013986,0.018648018648018648,"ANXA1, ANXA2, S100A11",0.9999,0.6591,1.517,0.00032900883338992634
35,14,PATTERN_24,3,2.1101462690963807e-05,0.01998001998001998,0.01998001998001998,"ORAI1, STIM1, TRPM2",0.2996,0.2013,1.489,0.00030653247110722673
36,56,PATTERN_63,7,8.788991755757736e-06,0.00999000999000999,0.01998001998001998,"ITPR1, ITPR2, ITPR3, ORAI1, ORAI2, STIM1, TRPC1",0.3111,0.2185,1.424,0.0008328333532819043
37,43,PATTERN_53,3,8.75382720338133e-06,0.006993006993006993,0.02097902097902098,"DDX41, DHX36, LRRFIP1",0.5616,0.4204,1.336,0.002575176800490695
38,49,PATTERN_57,3,1.3487267077123632e-05,0.02097902097902098,0.02097902097902098,"RNF25, UBE2D1, UBE2D2",0.4305,0.2814,1.53,8.598745929228812e-06
39,7,PATTERN_15,4,1.2529224409345424e-05,0.02097902097902098,0.02097902097902098,"RNF114, RNF4, UBE2D1, UBE2D2",0.4204,0.2881,1.459,7.595593301565137e-05
40,71,PATTERN_9,23,1.9433365926209305e-05,0.003996003996003996,0.021978021978021976,"ABI1, ACTB, ACTG1, ACTR2, ACTR3, ARPC1A, ARPC1B, ARPC2, ARPC3, ARPC4, ARPC5, BRK1, CDC42, CYFIP1, CYFIP2, LCP1, NCKAP1, NCKAP1L, WAS, WASF1, WASF2, WASF3, WASL",0.9635,0.637,1.513,1.551333965668732e-05
41,37,PATTERN_5,3,1.3654298911250893e-05,0.022977022977022976,0.022977022977022976,"MAPK8, RAPGEF3, RAPGEF4",0.1266,0.0966,1.311,0.018170434284573517
42,8,PATTERN_16,4,2.4548226955020515e-05,0.007992007992007992,0.023976023976023976,"CTSG, ELANE, PRTN3, SERPINB1",0.1479,0.1175,1.259,0.031720331053232693
43,4,PATTERN_12,3,1.8797645857439988e-05,0.004995004995004995,0.024975024975024972,"BTN2A1, CD209, XDH",0.0572,0.0395,1.447,0.0034373303574209493
44,55,PATTERN_61,3,7.724394492598182e-06,0.012987012987012988,0.025974025974025976,"ERAP1, ERAP2, TPP2",0.3289,0.2159,1.523,0.0006888175374158254
45,17,PATTERN_28,3,8.723353281414774e-06,0.012987012987012988,0.025974025974025976,"UBE2D2, UBE2N, ZNRF1",0.6018,0.3951,1.523,0.00014556127611821217
46,54,PATTERN_61,7,6.160771860646969e-06,0.008991008991008992,0.025974025974025976,"CD74, HLA-B, HLA-C, POLR1C, POLR3A, POLR3B, SEC61A2",0.9398,0.7214,1.303,0.00420944637832661
47,16,PATTERN_28,3,1.045605013569066e-05,0.008991008991008992,0.025974025974025976,"ATOX1, ATP7A, PDZD11",0.2586,0.1935,1.337,0.009342870087181845
48,39,PATTERN_51,6,1.3180387725677078e-05,0.025974025974025976,0.025974025974025976,"SAR1B, SEC23A, SEC24A, SEC24B, SEC24C, SEC24D",0.1829,0.1339,1.366,0.0045347621890866295
49,21,PATTERN_30,4,7.868157544509187e-06,0.012987012987012988,0.028471528471528472,"C1QB, CSTB, CTSL, MT2A",0.5903,0.3835,1.539,4.10146965813487e-05
50,20,PATTERN_30,17,5.2680274984134095e-06,0.01898101898101898,0.028471528471528472,"ACTB, ACTR2, ACTR3, DCTN1, DCTN2, DYNC1H1, DYNC1I1, DYNC1I2, KIF5A, KIF5B, KLC1, KLC2, KLC3, KLC4, MAPK8, TUBA1A, TUBB2A",0.49,0.3389,1.446,0.00019042749462019838
51,22,PATTERN_30,3,5.055713400993839e-06,0.01898101898101898,0.028471528471528472,"PPP3CA, PPP3CB, PPP3R1",0.4235,0.332,1.275,0.038337008755136355
52,44,PATTERN_53,3,1.2376961823286192e-05,0.01998001998001998,0.029970029970029972,"STX3, STX4, TXLNA",0.1612,0.1323,1.219,0.04749464952047436
53,3,PATTERN_12,4,1.38217294716754e-05,0.014985014985014986,0.029970029970029975,"FTH1, FTL, HMOX1, PLA2G6",1.4003,1.0509,1.333,9.361372803244649e-05
54,26,PATTERN_36,4,2.115132013319285e-05,0.007992007992007992,0.03196803196803197,"KPNA4, MYO5A, TRIM2, TRIM3",0.175,0.1287,1.36,0.007466013188332874
55,18,PATTERN_29,4,9.475736512996255e-06,0.022977022977022976,0.034465534465534464,"KPNA4, MYO5A, TRIM2, TRIM3",0.175,0.1287,1.36,0.007466013188332874
56,53,PATTERN_6,5,2.3025665992159222e-05,0.00999000999000999,0.03496503496503497,"GDI2, RAB24, RAB5B, RAB5C, RBSN",0.2386,0.17,1.403,0.002014724469788373
57,10,PATTERN_21,6,1.529184681693512e-05,0.023976023976023976,0.03596403596403597,"MOSPD2, OSBPL1A, STX1A, VAMP2, VAMP8, VAPA",0.3707,0.2413,1.536,1.7391455941842113e-06
58,35,PATTERN_49,4,4.105200696032608e-06,0.014985014985014986,0.037462537462537464,"C1QB, CSTB, CTSL, MT2A",0.5903,0.3835,1.539,4.10146965813487e-05
59,67,PATTERN_69,5,9.039925988994422e-06,0.03996003996003996,0.03996003996003996,"UBE2A, UBE2B, UBR1, UBR2, UBR4",0.4524,0.3241,1.396,0.0011312716964482303
60,36,PATTERN_49,3,2.448872683041627e-06,0.024975024975024976,0.03996003996003996,"LAMTOR2, LAMTOR3, MAPK3",0.2775,0.1651,1.681,4.492225160559427e-05
61,15,PATTERN_27,5,1.8127172353951292e-05,0.00999000999000999,0.03996003996003996,"FOS, MAPK7, RPS6KA1, RPS6KA2, RPS6KA3",0.218,0.1665,1.31,0.005641719503501448
62,45,PATTERN_54,7,2.7982573569220986e-06,0.04095904095904096,0.04095904095904096,"GDI2, LNPEP, RAB10, RAB14, SNAP23, STX4, VAMP2",0.4429,0.3155,1.404,0.00015134156457425398
63,60,PATTERN_65,4,1.2179698420021408e-05,0.01898101898101898,0.04195804195804196,"APEH, GLB1, IST1, NCSTN",0.1752,0.1154,1.519,0.00030653247110722673
64,24,PATTERN_35,4,1.1305978650000913e-05,0.013986013986013986,0.04195804195804196,"APEH, GLB1, IST1, NCSTN",0.1752,0.1154,1.519,0.00030653247110722673
65,25,PATTERN_36,5,1.3695124958700695e-05,0.02097902097902098,0.04195804195804196,"C4A, C4B, C4BPA, C4BPB, PROS1",0.0035,0.0028,1.285,0.005143254775714369
66,2,PATTERN_10,6,1.7536223813794015e-05,0.03296703296703297,0.04395604395604396,"DYNC1H1, DYNC1I1, DYNC1I2, TUBA1C, TUBA4A, TUBB2A",0.2631,0.2025,1.299,0.009342870087181845
67,0,PATTERN_10,17,1.5941392509424203e-05,0.023976023976023976,0.04395604395604396,"ALDOA, ALDOC, CNN2, DERA, GPI, HK3, IL2, PFKL, PGAM1, PGM1, PGM2, PKM, PYGB, PYGL, STAT4, TALDO1, VCL",0.2587,0.2035,1.271,0.019641486941510956
68,1,PATTERN_10,10,9.434569922357239e-06,0.02097902097902098,0.04395604395604396,"CALML5, MAPK1, MAPK3, MAPK8, NFATC1, NFATC2, NFATC3, PPP3CA, PPP3CB, PPP3R1",0.3648,0.2793,1.306,0.016459178446568582
69,70,PATTERN_8,7,1.8290096209385052e-05,0.04495504495504495,0.04495504495504495,"ARSA, GLA, GLB1, GM2A, GNS, HEXB, NPC2",0.1807,0.1231,1.468,0.0015182804959599503
70,69,PATTERN_73,8,1.7878988312056915e-06,0.014985014985014986,0.04495504495504496,"DDX58, EIF4E, EIF4G1, HNRNPA2B1, HNRNPDL, IFIH1, MAVS, PCBP2",0.566,0.4467,1.267,0.011598110241087383
71,9,PATTERN_19,16,2.315358229822925e-05,0.03396603396603397,0.04528804528804529,"MUC1, MUC12, MUC13, MUC15, MUC16, MUC17, MUC19, MUC2, MUC20, MUC21, MUC3A, MUC4, MUC5AC, MUC5B, MUC6, MUC7",0.0048,0.002,2.375,0.0031695013144515454
72,58,PATTERN_64,8,1.0677595019314435e-05,0.04695304695304695,0.04695304695304695,"EPX, LY86, MS4A3, PRG2, RNASE2, RNASE3, RNASE6, RNASET2",0.0954,0.043,2.218,1.4140149751325113e-06
